{
  "$schema": "http://json-schema.org/draft-07/schema#",
  "$id": "urn:mcp-security-evidence:evidence:1",
  "title": "Shared Evidence Schema v1",
  "type": "object",
  "required": ["schema_version", "event_id", "observed_at", "source_type", "assessment_id", "finding_type", "severity", "evidence", "confidence", "limitations", "remediation", "content_hash"],
  "properties": {
    "schema_version": { "const": "1" },
    "event_id": { "type": "string", "pattern": "^[0-9a-f]{8}-[0-9a-f]{4}-4[0-9a-f]{3}-[89ab][0-9a-f]{3}-[0-9a-f]{12}$" },
    "observed_at": { "type": "string", "pattern": "^\\d{4}-\\d{2}-\\d{2}T\\d{2}:\\d{2}:\\d{2}\\.\\d{3}Z$" },
    "source_type": { "type": "string", "minLength": 1 },
    "assessment_id": { "type": "string", "minLength": 1 },
    "finding_type": { "type": "string", "minLength": 1 },
    "severity": { "enum": ["info", "low", "medium", "high", "critical"] },
    "evidence": { "type": "object" },
    "confidence": { "enum": ["low", "medium", "high"] },
    "limitations": { "type": "array", "minItems": 1, "items": { "type": "string", "minLength": 1 } },
    "remediation": { "type": "string", "minLength": 1 },
    "content_hash": { "type": "string", "pattern": "^sha256:[0-9a-f]{64}$" }
  },
  "additionalProperties": false
}
